<?xml version="1.0"?>
<!DOCTYPE Report
[
<!ELEMENT Report (General ,(Doc|BPT)) >
<!ATTLIST Report ver CDATA #REQUIRED tmZone CDATA #REQUIRED>

<!ELEMENT General ( DocLocation ) >
<!ATTLIST General productName CDATA #REQUIRED productVer CDATA #REQUIRED os CDATA #REQUIRED host CDATA #REQUIRED qcserver CDATA #IMPLIED qcproject CDATA #IMPLIED SolManSolutionId CDATA #IMPLIED SolManProjectId CDATA #IMPLIED SolManTestPlanId CDATA #IMPLIED SolManTestPackageId CDATA #IMPLIED SolManUserInfoData CDATA #IMPLIED  >

<!ELEMENT BPT (DName,Res,DVer?,TSet?,TInst?,NodeArgs,AdditionalInfo*,Doc*) >
<!ATTLIST BPT rID ID #REQUIRED >

<!ELEMENT Doc (DName,ConfName?,Res,DVer?,TSet?,TInst?,RunType?,DT?,AdditionalInfo*,Step*,DIter*,Step*,Action*,Doc*,Summary?,TestMaintenanceSummary*,NodeArgs?) >
<!ATTLIST Doc rID ID #REQUIRED type (Test|BC|BPTWrapperTest|Flow|Group|Action) "Test" productName CDATA #REQUIRED BCIter CDATA #IMPLIED >

<!ELEMENT RunType ( #PCDATA )>
<!ATTLIST RunType fmStep (False|True) "False" batch (False|True) "False" upDesc (False|True) "False" upChk (False|True) "False" upAS (False|True) "False">

<!ELEMENT DName ( #PCDATA ) >

<!ELEMENT ConfName ( #PCDATA ) >

<!ELEMENT Res ( #PCDATA ) >

<!ELEMENT AdditionalInfo (AdditionalDataName,AdditionalDataValue ) >

<!ELEMENT AdditionalDataName ( #PCDATA ) >

<!ELEMENT AdditionalDataValue ( #PCDATA ) >

<!ELEMENT DVer ( #PCDATA ) >

<!ELEMENT TSet ( #PCDATA ) >

<!ELEMENT TInst ( #PCDATA ) >

<!ELEMENT DIter (Step*,Action+,Summary?,NodeArgs)>
<!ATTLIST DIter rID ID #REQUIRED iterID CDATA #REQUIRED>

<!ELEMENT DocLocation ( #PCDATA )>

<!ELEMENT Action (AName,AIter*,(Step|HtmlStep|Action)*, Summary,ActionMaintenanceSummary*, NodeArgs ) >
<!ATTLIST Action rID ID #REQUIRED>

<!ELEMENT AIter ((Step|HtmlStep|Action)*,DataMapping?, Summary?,NodeArgs) >
<!ATTLIST AIter rID ID #REQUIRED iterID CDATA #REQUIRED isCountable (False|True) "False" >

<!ELEMENT AName ( #PCDATA ) >

<!ELEMENT TestMaintenanceSummary (ActionMaintenanceSummary*) >
<!ATTLIST TestMaintenanceSummary ObjectsAdded CDATA #REQUIRED ObjectsUpdated CDATA #REQUIRED StepsUpdated CDATA #REQUIRED StepsComments CDATA #REQUIRED><!ELEMENT ActionMaintenanceSummary (ObjectChange* ) >
<!ATTLIST ActionMaintenanceSummary Action CDATA #REQUIRED Objects CDATA #REQUIRED Updated CDATA #REQUIRED LinesTotal CDATA #REQUIRED Added CDATA #REQUIRED LinesUpdated CDATA #REQUIRED>

<!ELEMENT ObjectChange  (Hierarchy, PropertyChangeList* ) >
<!ATTLIST ObjectChange Operation CDATA #IMPLIED OriginalRepository CDATA #IMPLIED>

<!ELEMENT PropertyChangeList (PropertyDef*) >

<!ELEMENT PropertyDef (OriginalValue, NewValue) >
<!ATTLIST PropertyDef PropName CDATA #REQUIRED OriginRegularExpression (True|False) "False" NewRegularExpression (True|False) "False" AddedProperty (True|False) "False" >

<!ELEMENT OriginalValue ( #PCDATA )>

<!ELEMENT NewValue ( #PCDATA )>

<!ELEMENT Hierarchy  (ObjectName, Hierarchy*) >
<!ATTLIST Hierarchy MicClass CDATA #REQUIRED>

<!ELEMENT ObjectName  ( #PCDATA ) >

<!ELEMENT Step (Obj,Details,Time,TimeTick* ,(Step|HtmlStep|Doc)*, DataMapping?, NodeArgs) >
<!ATTLIST Step rID ID #REQUIRED retval CDATA #IMPLIED>

<!ELEMENT HtmlStep (HTML,TimeTick*,(Step|HtmlStep|Doc)*,NodeArgs) >
<!ATTLIST HtmlStep rID ID #REQUIRED >

<!ELEMENT Obj ( #PCDATA ) >
<!ATTLIST Obj plainTxt (False|True) "True">

<!ELEMENT Details ( #PCDATA ) >
<!ATTLIST Details plainTxt (False|True) "True">

<!ELEMENT Time ( #PCDATA ) >

<!ELEMENT HTML ( #PCDATA ) >

<!ELEMENT Disp ( #PCDATA ) >

<!ELEMENT TimeTick ( #PCDATA ) >

<!ELEMENT DataMapping ( DataMappedItem* )>
<!ELEMENT DataMappedItem EMPTY >
<!ATTLIST DataMappedItem dsName CDATA #REQUIRED >
<!ATTLIST DataMappedItem rowId CDATA #REQUIRED >

<!ELEMENT NodeArgs (Disp,TopPane?,BtmPane?,ExtendedInfo? )>
<!ATTLIST NodeArgs eType CDATA #REQUIRED icon CDATA #REQUIRED nRep CDATA #REQUIRED UserNote CDATA #IMPLIED filter (False|True) "True">
<!ATTLIST NodeArgs status (Passed|Failed|Done|Warning|Information) "Done">
<!ATTLIST NodeArgs iconSel CDATA #IMPLIED nType CDATA #IMPLIED MovieMarker CDATA "">
<!ATTLIST NodeArgs Source CDATA #IMPLIED SourceLine CDATA #IMPLIED StepFlowItemKey CDATA #IMPLIED >

<!ELEMENT TopPane (Path)>

<!ELEMENT BtmPane ( (Path|WR)?,ASHilite?)>
<!ATTLIST BtmPane vType CDATA "HTML">

<!ELEMENT Path ( #PCDATA ) >

<!ELEMENT ASHilite ( #PCDATA ) >

<!ELEMENT WR ( #PCDATA ) >

<!ELEMENT ExtendedInfo ( StepData ) >

<!ATTLIST ExtendedInfo StepType CDATA #REQUIRED>
<!ELEMENT DT (NodeArgs) >
<!ATTLIST DT rID ID #REQUIRED>

<!ELEMENT Summary (Param*)>
<!ATTLIST Summary sTime CDATA #IMPLIED eTime CDATA #IMPLIED passed CDATA #IMPLIED failed CDATA #IMPLIED warnings CDATA #IMPLIED retval CDATA #IMPLIED stopped (False|True) "False" >

<!ELEMENT Param (ParamName,ParamVal)+ >
<!ATTLIST Param paramInOut (In|Out) "In">

<!ELEMENT ParamName ( #PCDATA ) >

<!ELEMENT ParamVal ( #PCDATA ) >

]
>
<Report ver="2.0" tmZone="India Standard Time">
<General productName="HP Unified Functional Testing" productVer="12.54" os="Windows 7" host="OTSI-LAP11"><DocLocation><![CDATA[C:\Users\dkalakoti\Desktop\tap soft\SAP_Automation_25_01\TAP\Scripts\SAP_win_Login]]></DocLocation></General>
<Doc rID="T1"   productName= "HP Unified Functional Testing"  >
<DName><![CDATA[SAP_win_Login]]></DName>
<Res><![CDATA[Res95]]></Res>
<DT rID="T2">
<NodeArgs eType="Table" icon="2" nRep="4" filter="False" >
<Disp><![CDATA[Run-Time Data Table]]></Disp>
<BtmPane vType="Table" >
<Path><![CDATA[Default.xls]]></Path>
</BtmPane>
</NodeArgs>
</DT>
<Step rID="T3">
<Obj plainTxt="False" ><![CDATA[Add-in(s) not activated]]></Obj>
<Details plainTxt="False" ><![CDATA[The following add-in(s) were associated with your test, but are not currently loaded: 
VisualBasic.]]></Details>
<Time><![CDATA[24-03-2017 - 17:27:31]]></Time>
<TimeTick>1490356651</TimeTick>
<NodeArgs eType="Replay" icon="0" nRep="5" status="Warning" >
<Disp><![CDATA[Add-in(s) not activated]]></Disp>
</NodeArgs>
</Step>
<DIter rID="T4" iterID="1" >
<Action rID="T5">
<AName><![CDATA[Action1]]></AName>
<Step rID="T6">
<Obj plainTxt="False" ><![CDATA[LoadFunctionLibrary]]></Obj>
<Details plainTxt="False" ><![CDATA[LoadFunctionLibrary function passed]]></Details>
<Time><![CDATA[24-03-2017 - 17:27:31]]></Time>
<TimeTick>1490356651</TimeTick>
<NodeArgs eType="Replay" icon="5" nRep="9" status="Passed" >
<Disp><![CDATA[LoadFunctionLibrary]]></Disp>
</NodeArgs>
</Step>
<Step rID="T7">
<Obj plainTxt="False" ><![CDATA[LoadFunctionLibrary]]></Obj>
<Details plainTxt="False" ><![CDATA[LoadFunctionLibrary function passed]]></Details>
<Time><![CDATA[24-03-2017 - 17:27:32]]></Time>
<TimeTick>1490356652</TimeTick>
<NodeArgs eType="Replay" icon="5" nRep="10" status="Passed" Source="Action1" SourceLine="-1" >
<Disp><![CDATA[LoadFunctionLibrary]]></Disp>
</NodeArgs>
</Step>
<Step rID="T8">
<Obj plainTxt="False" ><![CDATA[LoadFunctionLibrary]]></Obj>
<Details plainTxt="False" ><![CDATA[LoadFunctionLibrary function passed]]></Details>
<Time><![CDATA[24-03-2017 - 17:27:32]]></Time>
<TimeTick>1490356652</TimeTick>
<NodeArgs eType="Replay" icon="5" nRep="11" status="Passed" Source="Action1" SourceLine="-1" >
<Disp><![CDATA[LoadFunctionLibrary]]></Disp>
</NodeArgs>
</Step>
<Step rID="T9">
<Obj plainTxt="False" ><![CDATA[Run Error]]></Obj>
<Details plainTxt="False" ><![CDATA[Cannot connect to server &quot;192.168.1.91&quot;<BR/>Verify the server details in the SAP Logon dialog box.<BR/>Function file: C:\Users\dkalakoti\Desktop\tap soft\SAP_Automation_25_01\TAP\Library_Files\App_Specific\4.7\SAP_APP_Specific.qfl<BR/>Line (13): &quot;	SAPGuiUtil.OpenConnectionByIP sUrl,0&quot;.]]></Details>
<Time><![CDATA[24-03-2017 - 17:28:21]]></Time>
<TimeTick>1490356701</TimeTick>
<NodeArgs eType="Replay" icon="6" nRep="12" status="Failed" Source="C:\Users\dkalakoti\Desktop\tap soft\SAP_Automation_25_01\TAP\Library_Files\App_Specific\4.7\SAP_APP_Specific.qfl" SourceLine="12" >
<Disp><![CDATA[Run Error]]></Disp>
</NodeArgs>
</Step>
<Step rID="T10">
<Obj plainTxt="False" ><![CDATA[Session]]></Obj>
<Details plainTxt="False" ><![CDATA[SAPGuiSession]]></Details>
<Time><![CDATA[24-03-2017 - 17:28:32]]></Time>
<TimeTick>1490356712</TimeTick>
<Step rID="T11">
<Obj plainTxt="False" ><![CDATA[SAP]]></Obj>
<Details plainTxt="False" ><![CDATA[SAPGuiWindow]]></Details>
<Time><![CDATA[24-03-2017 - 17:28:32]]></Time>
<TimeTick>1490356712</TimeTick>
<Step rID="T12">
<Obj plainTxt="False" ><![CDATA[Client.Exist]]></Obj>
<Details plainTxt="False" ><![CDATA["Object does not exist"]]></Details>
<Time><![CDATA[24-03-2017 - 17:28:32]]></Time>
<TimeTick>1490356712</TimeTick>
<NodeArgs eType="Replay" icon="9" nRep="16" Source="C:\Users\dkalakoti\Desktop\tap soft\SAP_Automation_25_01\TAP\Library_Files\App_Specific\4.7\SAP_APP_Specific.qfl" SourceLine="-1" >
<Disp><![CDATA[Client.Exist]]></Disp>
</NodeArgs>
</Step>
<NodeArgs eType="Context" icon="8" nRep="15" Source="C:\Users\dkalakoti\Desktop\tap soft\SAP_Automation_25_01\TAP\Library_Files\App_Specific\4.7\SAP_APP_Specific.qfl" SourceLine="-1" >
<Disp><![CDATA[SAP]]></Disp>
</NodeArgs>
</Step>
<NodeArgs eType="Context" icon="7" nRep="14" Source="C:\Users\dkalakoti\Desktop\tap soft\SAP_Automation_25_01\TAP\Library_Files\App_Specific\4.7\SAP_APP_Specific.qfl" SourceLine="-1" >
<Disp><![CDATA[Session]]></Disp>
</NodeArgs>
</Step>
<Step rID="T13">
<Obj ><![CDATA[SAP application should be launched]]></Obj>
<Details ><![CDATA[Unable to launch SAP application]]></Details>
<Time><![CDATA[24-03-2017 - 17:28:32]]></Time>
<TimeTick>1490356712</TimeTick>
<NodeArgs eType="User" icon="10" nRep="17" status="Failed" Source="C:\Users\dkalakoti\Desktop\tap soft\SAP_Automation_25_01\TAP\Library_Files\App_Specific\4.7\SAP_APP_Specific.qfl" SourceLine="-1" >
<Disp><![CDATA[SAP application should be launched]]></Disp>
</NodeArgs>
</Step>
<Step rID="T14">
<Obj plainTxt="False" ><![CDATA[Session]]></Obj>
<Details plainTxt="False" ><![CDATA[SAPGuiSession]]></Details>
<Time><![CDATA[24-03-2017 - 17:28:43]]></Time>
<TimeTick>1490356723</TimeTick>
<Step rID="T15">
<Obj plainTxt="False" ><![CDATA[SAP]]></Obj>
<Details plainTxt="False" ><![CDATA[SAPGuiWindow]]></Details>
<Time><![CDATA[24-03-2017 - 17:28:43]]></Time>
<TimeTick>1490356723</TimeTick>
<Step rID="T16">
<Obj plainTxt="False" ><![CDATA[Client.Exist]]></Obj>
<Details plainTxt="False" ><![CDATA["Object does not exist"]]></Details>
<Time><![CDATA[24-03-2017 - 17:28:43]]></Time>
<TimeTick>1490356723</TimeTick>
<NodeArgs eType="Replay" icon="9" nRep="21" >
<Disp><![CDATA[Client.Exist]]></Disp>
</NodeArgs>
</Step>
<NodeArgs eType="Context" icon="8" nRep="20" >
<Disp><![CDATA[SAP]]></Disp>
</NodeArgs>
</Step>
<NodeArgs eType="Context" icon="7" nRep="19" >
<Disp><![CDATA[Session]]></Disp>
</NodeArgs>
</Step>
<Step rID="T17">
<Obj ><![CDATA[SAP Login Screen Validation]]></Obj>
<Details ><![CDATA[Screen Not Available]]></Details>
<Time><![CDATA[24-03-2017 - 17:28:43]]></Time>
<TimeTick>1490356723</TimeTick>
<NodeArgs eType="User" icon="10" nRep="22" status="Failed" >
<Disp><![CDATA[SAP Login Screen Validation]]></Disp>
</NodeArgs>
</Step>
<Step rID="T18">
<Obj plainTxt="False" ><![CDATA[Session]]></Obj>
<Details plainTxt="False" ><![CDATA[SAPGuiSession]]></Details>
<Time><![CDATA[24-03-2017 - 17:28:49]]></Time>
<TimeTick>1490356729</TimeTick>
<Step rID="T19">
<Obj plainTxt="False" ><![CDATA[Session]]></Obj>
<Details plainTxt="False" ><![CDATA[Cannot&nbsp;identify&nbsp;the&nbsp;object&nbsp;"Session"&nbsp;(of&nbsp;class&nbsp;SAPGuiSession).<br/>Verify&nbsp;that&nbsp;this&nbsp;object's&nbsp;properties&nbsp;match&nbsp;an&nbsp;object&nbsp;currently&nbsp;displayed&nbsp;in&nbsp;your&nbsp;application.]]></Details>
<Time><![CDATA[24-03-2017 - 17:28:49]]></Time>
<TimeTick>1490356729</TimeTick>
<Step rID="T20">
<Obj plainTxt="False" ><![CDATA[Session]]></Obj>
<Details plainTxt="False" ><![CDATA[Object's physical description:<br>Name = ses[0]<br>Mercury Class = SAPGuiSession<br>SapGui numeric component type = 12<br>]]></Details>
<Time><![CDATA[24-03-2017 - 17:28:49]]></Time>
<TimeTick>1490356729</TimeTick>
<NodeArgs eType="Replay" icon="6" nRep="26" status="Warning" nType="Description" >
<Disp><![CDATA[Session]]></Disp>
</NodeArgs>
</Step>
<NodeArgs eType="Replay" icon="7" nRep="25" status="Failed" nType="Run Error" >
<Disp><![CDATA[Session]]></Disp>
</NodeArgs>
</Step>
<Step rID="T21">
<Obj plainTxt="False" ><![CDATA[Session]]></Obj>
<Details plainTxt="False" ><![CDATA[Cannot&nbsp;identify&nbsp;the&nbsp;object&nbsp;"Session"&nbsp;(of&nbsp;class&nbsp;SAPGuiSession).<br/>Verify&nbsp;that&nbsp;this&nbsp;object's&nbsp;properties&nbsp;match&nbsp;an&nbsp;object&nbsp;currently&nbsp;displayed&nbsp;in&nbsp;your&nbsp;application.]]></Details>
<Time><![CDATA[24-03-2017 - 17:29:14]]></Time>
<TimeTick>1490356754</TimeTick>
<Step rID="T22">
<Obj plainTxt="False" ><![CDATA[Session]]></Obj>
<Details plainTxt="False" ><![CDATA[Object's physical description:<br>Name = ses[0]<br>Mercury Class = SAPGuiSession<br>SapGui numeric component type = 12<br>]]></Details>
<Time><![CDATA[24-03-2017 - 17:29:14]]></Time>
<TimeTick>1490356754</TimeTick>
<NodeArgs eType="Replay" icon="6" nRep="29" status="Warning" nType="Description" Source="C:\Users\dkalakoti\Desktop\tap soft\SAP_Automation_25_01\TAP\Library_Files\App_Specific\4.7\SAP_APP_Specific.qfl" SourceLine="295" >
<Disp><![CDATA[Session]]></Disp>
</NodeArgs>
</Step>
<NodeArgs eType="Replay" icon="7" nRep="28" status="Failed" nType="Run Error" Source="C:\Users\dkalakoti\Desktop\tap soft\SAP_Automation_25_01\TAP\Library_Files\App_Specific\4.7\SAP_APP_Specific.qfl" SourceLine="295" >
<Disp><![CDATA[Session]]></Disp>
</NodeArgs>
</Step>
<NodeArgs eType="Context" icon="7" nRep="24" status="Failed" >
<Disp><![CDATA[Session]]></Disp>
</NodeArgs>
</Step>
<Step rID="T23">
<Obj plainTxt="False" ><![CDATA[Session]]></Obj>
<Details plainTxt="False" ><![CDATA[SAPGuiSession]]></Details>
<Time><![CDATA[24-03-2017 - 17:29:14]]></Time>
<TimeTick>1490356754</TimeTick>
<Step rID="T24">
<Obj plainTxt="False" ><![CDATA[Run Error]]></Obj>
<Details plainTxt="False" ><![CDATA[Cannot identify the object &quot;Session&quot; (of class SAPGuiSession).<BR/>Verify that this object's properties match an object currently displayed in your application.<BR/>Function file: C:\Users\dkalakoti\Desktop\tap soft\SAP_Automation_25_01\TAP\Library_Files\App_Specific\4.7\SAP_APP_Specific.qfl<BR/>Line (296): &quot;	SAPGuiSession(&quot;Session&quot;).Close&quot;.]]></Details>
<Time><![CDATA[24-03-2017 - 17:29:14]]></Time>
<TimeTick>1490356754</TimeTick>
<NodeArgs eType="Replay" icon="6" nRep="31" status="Failed" Source="C:\Users\dkalakoti\Desktop\tap soft\SAP_Automation_25_01\TAP\Library_Files\App_Specific\4.7\SAP_APP_Specific.qfl" SourceLine="295" >
<Disp><![CDATA[Run Error]]></Disp>
</NodeArgs>
</Step>
<Step rID="T25">
<Obj plainTxt="False" ><![CDATA[Stop Run]]></Obj>
<Details plainTxt="False" ><![CDATA[Run stopped by user.]]></Details>
<Time><![CDATA[24-03-2017 - 17:29:15]]></Time>
<TimeTick>1490356755</TimeTick>
<NodeArgs eType="General" icon="11" nRep="32" status="Information" >
<Disp><![CDATA[Stop Run]]></Disp>
</NodeArgs>
</Step>
<NodeArgs eType="Context" icon="7" nRep="30" status="Failed" Source="C:\Users\dkalakoti\Desktop\tap soft\SAP_Automation_25_01\TAP\Library_Files\App_Specific\4.7\SAP_APP_Specific.qfl" SourceLine="295" >
<Disp><![CDATA[Session]]></Disp>
</NodeArgs>
</Step>
<Summary sTime="24-03-2017 - 17:27:31" eTime="24-03-2017 - 17:29:15" passed="3" failed="6" warnings="2" ></Summary>
<NodeArgs eType="StartAction" icon="4" nRep="8" status="Failed" >
<Disp><![CDATA[Action1 Summary]]></Disp>
</NodeArgs>
</Action>
<NodeArgs eType="StartIteration" icon="3" nRep="7" status="Failed" >
<Disp><![CDATA[SAP_win_Login Iteration 1 (Row 1)]]></Disp>
</NodeArgs>
</DIter>
<Summary sTime="24-03-2017 - 17:27:30" eTime="24-03-2017 - 17:29:15" passed="3" failed="6" warnings="3" ></Summary>
<NodeArgs eType="StartTest" icon="1" nRep="3" status="Failed" >
<Disp><![CDATA[Test SAP_win_Login Summary]]></Disp>
</NodeArgs>
</Doc>
</Report>